product_id,product_name,product_desc,product_stock
1,Tomato,"Our tomatoes are sourced from local farms known for their commitment to quality and sustainable farming practices. Each tomato is carefully harvested at the peak of ripeness, ensuring maximum flavor and nutrition.",0
2,Mango,"Indulge your taste buds in the tantalizing flavors of the mango, a tropical treasure that brings a burst of sweetness to every bite.",27
5,orange,"Our oranges are bursting with natural sweetness and are a great source of essential vitamins and minerals. Each bite offers a delightful combination of tangy and sweet notes, making them a perfect addition to your daily diet.",31
15,Apple,"Experience the crisp and refreshing taste of our premium apples, straight from the orchard. Our carefully selected apples are a perfect balance of sweetness and tartness, making them a delightful and healthy treat for all ages.",24
16,Amul cheese(200g),"The cubic shapes of Amul Processed Cheese Chiplets make it perfect for parties. They are best served with pineapple dices, and to add some zing, you can sprinkle some chaat masala over the cubes. ",100
24,Potato,we have fresh and best quality potatoes sourced from our trusted farmers,95
25,Eggs(12 pcs),we have best quality eggs. 1 unit contains 12 pcs.,57
